[
  {
    "filing_type": "Original",
    "filing_year": "2023",
    "fuel_type": "DI",
    "interest_due": "$0.00",
    "jurisdiction": "AL",
    "net_gallons": "8,760",
    "quarter": "Q1",
    "return_id": "RTN-2023-Q1-86-001",
    "surtax_due": "$0.00",
    "tax_due_refund": "$4,566.59",
    "tax_paid_gallons": "0",
    "tax_rate": "0.5213",
    "taxable_gallons": "8,760",
    "taxable_miles": "51,983",
    "total_due_refund": "$4,566.59",
    "total_miles": "52,709"
  },
  {
    "filing_type": "Original",
    "filing_year": "2023",
    "fuel_type": "DI",
    "interest_due": "$0.00",
    "jurisdiction": "AR",
    "net_gallons": "10,600",
    "quarter": "Q1",
    "return_id": "RTN-2023-Q1-86-001",
    "surtax_due": "$0.00",
    "tax_due_refund": "$7,553.56",
    "tax_paid_gallons": "0",
    "tax_rate": "0.7126",
    "taxable_gallons": "10,600",
    "taxable_miles": "71,107",
    "total_due_refund": "$7,553.56",
    "total_miles": "71,996"
  },
  {
    "filing_type": "Original",
    "filing_year": "2023",
    "fuel_type": "DI",
    "interest_due": "$0.00",
    "jurisdiction": "AZ",
    "net_gallons": "14,592",
    "quarter": "Q1",
    "return_id": "RTN-2023-Q1-86-001",
    "surtax_due": "$267.85",
    "tax_due_refund": "$3,658.21",
    "tax_paid_gallons": "0",
    "tax_rate": "0.2507",
    "taxable_gallons": "14,592",
    "taxable_miles": "107,328",
    "total_due_refund": "$3,926.06",
    "total_miles": "107,743"
  },
  {
    "filing_type": "Original",
    "filing_year": "2023",
    "fuel_type": "DI",
    "interest_due": "$0.00",
    "jurisdiction": "CA",
    "net_gallons": "30,076",
    "quarter": "Q1",
    "return_id": "RTN-2023-Q1-86-001",
    "surtax_due": "$0.00",
    "tax_due_refund": "$9,016.78",
    "tax_paid_gallons": "0",
    "tax_rate": "0.2998",
    "taxable_gallons": "30,076",
    "taxable_miles": "220,455",
    "total_due_refund": "$9,016.78",
    "total_miles": "220,720"
  },
  {
    "filing_type": "Original",
    "filing_year": "2023",
    "fuel_type": "DI",
    "interest_due": "$0.00",
    "jurisdiction": "CO",
    "net_gallons": "21,666",
    "quarter": "Q1",
    "return_id": "RTN-2023-Q1-86-001",
    "surtax_due": "$0.00",
    "tax_due_refund": "$15,697.02",
    "tax_paid_gallons": "0",
    "tax_rate": "0.7245",
    "taxable_gallons": "21,666",
    "taxable_miles": "155,209",
    "total_due_refund": "$15,697.02",
    "total_miles": "155,506"
  },
  {
    "filing_type": "Original",
    "filing_year": "2023",
    "fuel_type": "DI",
    "interest_due": "$0.00",
    "jurisdiction": "CT",
    "net_gallons": "34,896",
    "quarter": "Q1",
    "return_id": "RTN-2023-Q1-86-001",
    "surtax_due": "$1,095.71",
    "tax_due_refund": "$13,368.66",
    "tax_paid_gallons": "0",
    "tax_rate": "0.3831",
    "taxable_gallons": "34,896",
    "taxable_miles": "215,383",
    "total_due_refund": "$14,464.37",
    "total_miles": "216,172"
  },
  {
    "filing_type": "Original",
    "filing_year": "2023",
    "fuel_type": "DI",
    "interest_due": "$0.00",
    "jurisdiction": "FL",
    "net_gallons": "2,512",
    "quarter": "Q1",
    "return_id": "RTN-2023-Q1-86-001",
    "surtax_due": "$0.00",
    "tax_due_refund": "$927.68",
    "tax_paid_gallons": "0",
    "tax_rate": "0.3693",
    "taxable_gallons": "2,512",
    "taxable_miles": "18,289",
    "total_due_refund": "$927.68",
    "total_miles": "18,706"
  },
  {
    "filing_type": "Original",
    "filing_year": "2023",
    "fuel_type": "DI",
    "interest_due": "$0.00",
    "jurisdiction": "GA",
    "net_gallons": "4,972",
    "quarter": "Q1",
    "return_id": "RTN-2023-Q1-86-001",
    "surtax_due": "$0.00",
    "tax_due_refund": "$1,629.32",
    "tax_paid_gallons": "0",
    "tax_rate": "0.3277",
    "taxable_gallons": "4,972",
    "taxable_miles": "31,376",
    "total_due_refund": "$1,629.32",
    "total_miles": "31,667"
  },
  {
    "filing_type": "Original",
    "filing_year": "2023",
    "fuel_type": "DI",
    "interest_due": "$14.12",
    "jurisdiction": "IA",
    "net_gallons": "11,905",
    "quarter": "Q1",
    "return_id": "RTN-2023-Q1-86-001",
    "surtax_due": "$0.00",
    "tax_due_refund": "$2,039.33",
    "tax_paid_gallons": "0",
    "tax_rate": "0.1713",
    "taxable_gallons": "11,905",
    "taxable_miles": "96,374",
    "total_due_refund": "$2,053.45",
    "total_miles": "96,412"
  },
  {
    "filing_type": "Original",
    "filing_year": "2023",
    "fuel_type": "DI",
    "interest_due": "$0.00",
    "jurisdiction": "ID",
    "net_gallons": "6,578",
    "quarter": "Q1",
    "return_id": "RTN-2023-Q1-86-001",
    "surtax_due": "$0.00",
    "tax_due_refund": "$3,190.33",
    "tax_paid_gallons": "0",
    "tax_rate": "0.4850",
    "taxable_gallons": "6,578",
    "taxable_miles": "53,910",
    "total_due_refund": "$3,190.33",
    "total_miles": "54,689"
  },
  {
    "filing_type": "Original",
    "filing_year": "2023",
    "fuel_type": "DI",
    "interest_due": "$0.00",
    "jurisdiction": "IL",
    "net_gallons": "1,827",
    "quarter": "Q1",
    "return_id": "RTN-2023-Q1-86-001",
    "surtax_due": "$20.30",
    "tax_due_refund": "$926.29",
    "tax_paid_gallons": "11,523",
    "tax_rate": "0.5070",
    "taxable_gallons": "13,350",
    "taxable_miles": "107,171",
    "total_due_refund": "$946.59",
    "total_miles": "107,707"
  },
  {
    "filing_type": "Original",
    "filing_year": "2023",
    "fuel_type": "DI",
    "interest_due": "$0.00",
    "jurisdiction": "KS",
    "net_gallons": "2,005",
    "quarter": "Q1",
    "return_id": "RTN-2023-Q1-86-001",
    "surtax_due": "$14.85",
    "tax_due_refund": "$377.54",
    "tax_paid_gallons": "0",
    "tax_rate": "0.1883",
    "taxable_gallons": "2,005",
    "taxable_miles": "10,767",
    "total_due_refund": "$392.39",
    "total_miles": "10,883"
  },
  {
    "filing_type": "Original",
    "filing_year": "2023",
    "fuel_type": "DI",
    "interest_due": "$0.00",
    "jurisdiction": "KY",
    "net_gallons": "5,917",
    "quarter": "Q1",
    "return_id": "RTN-2023-Q1-86-001",
    "surtax_due": "$56.64",
    "tax_due_refund": "$1,540.79",
    "tax_paid_gallons": "29,823",
    "tax_rate": "0.2604",
    "taxable_gallons": "35,740",
    "taxable_miles": "273,310",
    "total_due_refund": "$1,597.43",
    "total_miles": "273,445"
  },
  {
    "filing_type": "Original",
    "filing_year": "2023",
    "fuel_type": "DI",
    "interest_due": "$0.00",
    "jurisdiction": "LA",
    "net_gallons": "18,417",
    "quarter": "Q1",
    "return_id": "RTN-2023-Q1-86-001",
    "surtax_due": "$0.00",
    "tax_due_refund": "$8,670.72",
    "tax_paid_gallons": "0",
    "tax_rate": "0.4708",
    "taxable_gallons": "18,417",
    "taxable_miles": "124,485",
    "total_due_refund": "$8,670.72",
    "total_miles": "125,434"
  },
  {
    "filing_type": "Original",
    "filing_year": "2023",
    "fuel_type": "DI",
    "interest_due": "$0.00",
    "jurisdiction": "MD",
    "net_gallons": "-21,073",
    "quarter": "Q1",
    "return_id": "RTN-2023-Q1-86-001",
    "surtax_due": "$0.00",
    "tax_due_refund": "($7,512.52)",
    "tax_paid_gallons": "48,665",
    "tax_rate": "0.3565",
    "taxable_gallons": "27,592",
    "taxable_miles": "160,380",
    "total_due_refund": "($7,512.52)",
    "total_miles": "160,991"
  },
  {
    "filing_type": "Original",
    "filing_year": "2023",
    "fuel_type": "DI",
    "interest_due": "$0.00",
    "jurisdiction": "MI",
    "net_gallons": "29,074",
    "quarter": "Q1",
    "return_id": "RTN-2023-Q1-86-001",
    "surtax_due": "$0.00",
    "tax_due_refund": "$6,294.52",
    "tax_paid_gallons": "872",
    "tax_rate": "0.2165",
    "taxable_gallons": "29,946",
    "taxable_miles": "201,675",
    "total_due_refund": "$6,294.52",
    "total_miles": "202,411"
  },
  {
    "filing_type": "Original",
    "filing_year": "2023",
    "fuel_type": "DI",
    "interest_due": "$0.00",
    "jurisdiction": "MN",
    "net_gallons": "-19,312",
    "quarter": "Q1",
    "return_id": "RTN-2023-Q1-86-001",
    "surtax_due": "$0.00",
    "tax_due_refund": "($8,145.80)",
    "tax_paid_gallons": "38,871",
    "tax_rate": "0.4218",
    "taxable_gallons": "19,559",
    "taxable_miles": "138,797",
    "total_due_refund": "($8,145.80)",
    "total_miles": "139,395"
  },
  {
    "filing_type": "Original",
    "filing_year": "2023",
    "fuel_type": "DI",
    "interest_due": "$0.00",
    "jurisdiction": "MO",
    "net_gallons": "18,171",
    "quarter": "Q1",
    "return_id": "RTN-2023-Q1-86-001",
    "surtax_due": "$0.00",
    "tax_due_refund": "$7,780.82",
    "tax_paid_gallons": "961",
    "tax_rate": "0.4282",
    "taxable_gallons": "19,132",
    "taxable_miles": "158,867",
    "total_due_refund": "$7,780.82",
    "total_miles": "159,651"
  },
  {
    "filing_type": "Original",
    "filing_year": "2023",
    "fuel_type": "DI",
    "interest_due": "$0.00",
    "jurisdiction": "MS",
    "net_gallons": "8,548",
    "quarter": "Q1",
    "return_id": "RTN-2023-Q1-86-001",
    "surtax_due": "$0.00",
    "tax_due_refund": "$6,328.08",
    "tax_paid_gallons": "0",
    "tax_rate": "0.7403",
    "taxable_gallons": "8,548",
    "taxable_miles": "57,201",
    "total_due_refund": "$6,328.08",
    "total_miles": "57,316"
  },
  {
    "filing_type": "Original",
    "filing_year": "2023",
    "fuel_type": "DI",
    "interest_due": "$0.00",
    "jurisdiction": "ND",
    "net_gallons": "9,006",
    "quarter": "Q1",
    "return_id": "RTN-2023-Q1-86-001",
    "surtax_due": "$0.00",
    "tax_due_refund": "$6,790.52",
    "tax_paid_gallons": "13,843",
    "tax_rate": "0.7540",
    "taxable_gallons": "22,849",
    "taxable_miles": "140,110",
    "total_due_refund": "$6,790.52",
    "total_miles": "140,506"
  },
  {
    "filing_type": "Original",
    "filing_year": "2023",
    "fuel_type": "DI",
    "interest_due": "$0.00",
    "jurisdiction": "NJ",
    "net_gallons": "22,325",
    "quarter": "Q1",
    "return_id": "RTN-2023-Q1-86-001",
    "surtax_due": "$0.00",
    "tax_due_refund": "$15,614.11",
    "tax_paid_gallons": "0",
    "tax_rate": "0.6994",